{
  "schema_version": "1.0.0",
  "issue": 377,
  "pull_request": 378,
  "status": "PENDING",
  "decision": null,
  "frozen_commit": null,
  "frozen_tree": null,
  "reviewed_content_sha256": "88aec7b00ce5cb23ad628942e9c19b37ee857fc687ce6ef7c7687ef38e8078ec",
  "review_registry_ref": "fixtures/world_model/refinement/v1/review_registry.json",
  "runtime_migration_authorized": false,
  "airtable_historical_write_authorized": false,
  "public_capability_change": false
}
